{"schema_version":"arp/v1","run_id":"fixture-run-001","started_at":"2026-07-30T00:00:00+00:00","completed_at":"2026-07-30T00:00:01+00:00","decision":{"outcome":"fail","reasons":[{"code":"threshold_not_met","message":"Measured value is below threshold.","evidence":[{"kind":"measurement","subject":"quality","observed":0.7,"expected":0.9,"comparator":">="}]}]},"identifiers":{"build":"fixture-build"},"hashes":{"input":"fixture-hash"},"artifacts":{},"metadata":{"fixture":true},"configuration":{"mode":"offline"}}
